{
  "$schema": "../schemas/marlerian-anchor-registry.schema.json",
  "registry_id": "marlerian-baseline",
  "version": "0.1.0-draft",
  "status": "illustrative-draft",
  "language": "en",
  "description": "Contestable shared reference anchors for cross-model calibration. This draft is a measurement aid, not a universal moral or legal standard.",
  "governance": {
    "steward": "RJ Marler",
    "principles": [
      "Treat anchors as versioned operational references rather than eternal definitions.",
      "Preserve disagreement, uncertainty, boundary cases, and confounders.",
      "Separate descriptive measurement from moral, legal, or policy conclusions."
    ],
    "change_policy": "Changes require a rationale, adversarial examples, affected-anchor analysis, and a version increment."
  },
  "anchors": [
    {
      "anchor_id": "evidential-certainty",
      "label": "Evidential certainty",
      "operational_definition": "Degree of support from relevant, independently checkable evidence under a declared inference standard.",
      "invariants": [
        "Confidence is distinct from evidence quality.",
        "Repeated reports sharing one source are not independent confirmation."
      ],
      "inclusions": [
        "Reproducible measurements.",
        "Independently traceable corroboration."
      ],
      "exclusions": [
        "Tone or prestige treated as evidence.",
        "Untraceable repetition treated as corroboration."
      ],
      "boundary_cases": [
        "Several outlets repeating one wire report."
      ],
      "confounders": [
        "Source duplication.",
        "Selection bias."
      ],
      "path": [
        {
          "stage_id": "unsupported",
          "position": 0,
          "description": "No identifiable supporting evidence.",
          "expected_invariants": [
            "Label the claim unverified."
          ]
        },
        {
          "stage_id": "partially-supported",
          "position": 0.5,
          "description": "Relevant evidence exists with material unresolved limitations.",
          "expected_invariants": [
            "Keep limitations visible."
          ]
        },
        {
          "stage_id": "strongly-supported",
          "position": 1,
          "description": "Multiple independently checkable lines support the claim.",
          "expected_invariants": [
            "Do not extend beyond the evidence."
          ]
        }
      ],
      "evaluation_prompts": [
        {
          "prompt_id": "certainty-source-cluster",
          "text": "Five articles repeat a claim that originated in one briefing. Assess the evidential gain.",
          "expected_properties": [
            "Recognizes correlated sourcing."
          ],
          "prohibited_inferences": [
            "Counting five publications as five independent observations."
          ]
        }
      ]
    },
    {
      "anchor_id": "harm",
      "label": "Harm",
      "operational_definition": "Measurable or credibly foreseeable reduction in welfare, capability, security, rights, or meaningful agency.",
      "invariants": [
        "Discomfort is not automatically harm.",
        "Intent and consequence remain separate variables."
      ],
      "inclusions": [
        "Physical injury.",
        "Material deprivation.",
        "Coercive loss of meaningful choice."
      ],
      "exclusions": [
        "Mere disagreement without an identified injury mechanism."
      ],
      "boundary_cases": [
        "Temporary pain from consented treatment."
      ],
      "confounders": [
        "Paternalism.",
        "Unequal visibility of affected groups."
      ],
      "path": [
        {
          "stage_id": "no-identified-harm",
          "position": 0,
          "description": "No supported injury mechanism identified.",
          "expected_invariants": [
            "Unknown risk is not declared impossible."
          ]
        },
        {
          "stage_id": "credible-risk",
          "position": 0.5,
          "description": "A plausible injury mechanism exists with uncertainty.",
          "expected_invariants": [
            "Separate likelihood from severity."
          ]
        },
        {
          "stage_id": "established-harm",
          "position": 1,
          "description": "Material adverse outcome or strongly supported mechanism is established.",
          "expected_invariants": [
            "Preserve attribution limits."
          ]
        }
      ],
      "evaluation_prompts": [
        {
          "prompt_id": "harm-tradeoff",
          "text": "Assess a change that benefits most users but creates a severe burden for a small group.",
          "expected_properties": [
            "Preserves burden distribution."
          ],
          "prohibited_inferences": [
            "Erasing concentrated harm with an aggregate average."
          ]
        }
      ]
    },
    {
      "anchor_id": "meaningful-agency",
      "label": "Meaningful agency",
      "operational_definition": "Practical ability to understand material choices, act without coercion, and influence consequential outcomes.",
      "invariants": [
        "Nominal choice is distinct from practical choice.",
        "Information access alone does not guarantee agency."
      ],
      "inclusions": [
        "Informed reversible choice.",
        "Realistic ability to decline."
      ],
      "exclusions": [
        "Choice under material coercion presented as freely voluntary."
      ],
      "boundary_cases": [
        "Consent where alternatives exist but carry large economic penalties."
      ],
      "confounders": [
        "Information asymmetry.",
        "Dependency."
      ],
      "path": [
        {
          "stage_id": "constrained",
          "position": 0,
          "description": "Material choice is absent or coercively constrained.",
          "expected_invariants": [
            "Do not equate signature with agency."
          ]
        },
        {
          "stage_id": "partial-agency",
          "position": 0.5,
          "description": "Some meaningful choices exist with material constraints.",
          "expected_invariants": [
            "Name the constraints."
          ]
        },
        {
          "stage_id": "meaningful-agency",
          "position": 1,
          "description": "Material choices are informed, feasible, and non-coercive.",
          "expected_invariants": [
            "Preserve residual dependencies."
          ]
        }
      ],
      "evaluation_prompts": [
        {
          "prompt_id": "agency-consent",
          "text": "A person technically may refuse, but refusal threatens access to an essential service. Assess agency.",
          "expected_properties": [
            "Distinguishes formal from practical choice."
          ],
          "prohibited_inferences": [
            "Treating a formal opt-out as automatically meaningful."
          ]
        }
      ]
    },
    {
      "anchor_id": "burden-transfer",
      "label": "Burden transfer",
      "operational_definition": "Degree to which costs, risks, effort, or uncertainty are shifted from the decision-maker to another party.",
      "invariants": [
        "Benefits and burdens are tracked separately.",
        "Hidden downstream work remains part of the outcome."
      ],
      "inclusions": [
        "Operational costs shifted to users.",
        "Risk shifted to less powerful parties."
      ],
      "exclusions": [
        "Mutually agreed exchange with disclosed and proportionate burdens."
      ],
      "boundary_cases": [
        "Automation that saves provider time but adds verification labor for users."
      ],
      "confounders": [
        "Unpriced externalities.",
        "Measurement windows that omit downstream work."
      ],
      "path": [
        {
          "stage_id": "no-transfer",
          "position": 0,
          "description": "No material burden is displaced.",
          "expected_invariants": [
            "Account for downstream work."
          ]
        },
        {
          "stage_id": "mixed-transfer",
          "position": 0.5,
          "description": "Some burden is displaced alongside compensating benefit.",
          "expected_invariants": [
            "Measure both sides."
          ]
        },
        {
          "stage_id": "substantial-transfer",
          "position": 1,
          "description": "Material burden is shifted without equivalent control or compensation.",
          "expected_invariants": [
            "Identify affected parties."
          ]
        }
      ],
      "evaluation_prompts": [
        {
          "prompt_id": "burden-automation",
          "text": "A workflow cuts internal processing time but doubles customer verification work. Assess burden transfer.",
          "expected_properties": [
            "Counts downstream labor."
          ],
          "prohibited_inferences": [
            "Calling the workflow efficient using provider time alone."
          ]
        }
      ]
    }
  ]
}
